{
  "schema_version": "1.0.0",
  "screening_policy_version": "ETM-EVIDENCE-1.5",
  "enabled": true,
  "lookback_days": 14,
  "max_results_per_query": 20,
  "max_excerpt_characters": 480,
  "channels": {
    "official_sources": true,
    "public_issue_search": true,
    "research_search": true,
    "general_web_search": false
  },
  "public_issue_repositories": ["anthropics/claude-code", "cursor/cursor"],
  "reviewed_exclusions": [
    {
      "source_url": "https://doi.org/10.7759/cureus.116995",
      "reviewed_on": "2026-10-07",
      "reason": "Clinical delirium care review; no AI product or temporal-continuity behavior under observation."
    },
    {
      "source_url": "https://doi.org/10.1145/3832783.3837449",
      "reviewed_on": "2026-10-09",
      "reason": "Mobile GUI exploration methodology; historical context refers to test coverage, not temporal validity of an AI assistant's statements."
    }
  ],
  "queries": [
    {
      "id": "temporal-continuity",
      "terms": "AI agent current date elapsed time temporal awareness conversation continuity",
      "issue_terms": "\"current date\" OR \"time awareness\" OR yesterday",
      "probe_ids": ["probe-temporal-anchor", "probe-elapsed"]
    },
    {
      "id": "stale-state",
      "terms": "AI agent stale context revalidate changed state outdated information",
      "issue_terms": "\"stale context\" OR \"stale memory\" OR \"changed state\"",
      "probe_ids": ["probe-revalidation", "probe-state-reconciliation"]
    },
    {
      "id": "historical-validity",
      "terms": "AI agent historical context previously true current state memory",
      "issue_terms": "\"historical context\" OR \"past state\" OR \"prior session\"",
      "probe_ids": ["probe-historical-validity"]
    }
  ]
}
